{"schema":"pdfform.result/2","requestId":"golden-request-1","operation":"run","status":"ok","exitCode":0,"artifactState":"published","validationLevels":{"syntax":"passed","profile":"passed","data":"passed","binding":"passed","packet":"passed","render":"passed","publication":"passed"},"tool":{"name":"pdfform","version":"golden-v1","build":"golden-build-1","engine":"synthetic","runtime":".NET","sourceReference":"independent-golden"},"profiles":[{"id":"golden-profile","revision":"2026","profileVersion":1,"sha256":"aaaaaaaaaaaaaaaaaaaaaaaaaaaaaaaaaaaaaaaaaaaaaaaaaaaaaaaaaaaaaaaa"}],"templates":[{"id":"golden-template","sha256":"bbbbbbbbbbbbbbbbbbbbbbbbbbbbbbbbbbbbbbbbbbbbbbbbbbbbbbbbbbbbbbbb"}],"outputs":[{"id":"alpha","path":"forms/a.pdf","bytes":32,"sha256":"630dcd2966c4336691125448bbb25b4ff412a49c732db2c8abc1b8581bd710dd"},{"id":"beta","path":"forms/b.pdf","bytes":32,"sha256":"72dbb7336c76780023f83da4c355f2eeea85733b13d3477697917790c1229084"}],"errors":[],"warnings":[{"code":"W_GOLDEN","stage":"data","message":"Golden control warning.","severity":"warning","key":"example.key","field":"synthetic-field","ruleId":"example-rule"}],"stats":{"checked":2},"filingReadiness":"not_assessed"}